{
  "schema_version": "puyo-overlay-health/v1",
  "server_status": "degraded",
  "session_id": "session-worker-example",
  "latest_stream_seq": 43,
  "latest_snapshot_age_ms": 28,
  "subscriber_count": 1,
  "subscriber_limit": 4,
  "telemetry_health": "healthy",
  "bound_host": "127.0.0.1",
  "bound_port": 8765,
  "started_at_utc": "2026-09-02T07:00:00Z",
  "checked_at_utc": "2026-09-02T07:01:23Z",
  "last_error_code": "practical_worker_fault"
}
